{
  "id": "chalk",
  "name": "Chalk",
  "family": "vibrant",
  "sector": "Education / EdTech",
  "tags": ["friendly", "bright", "image-rich", "playful", "approachable", "learning"],
  "mode": "light",
  "tokens": {
    "color": {
      "bg": "255 249 240",
      "surface": "255 255 255",
      "ink": "35 48 74",
      "muted": "104 116 140",
      "line": "232 224 211",
      "primary": "255 122 89",
      "onPrimary": "255 255 255",
      "accent": "61 184 255",
      "accent2": "255 199 92"
    },
    "type": {
      "display": "'Gabarito', ui-sans-serif, system-ui, sans-serif",
      "body": "'General Sans', ui-sans-serif, system-ui, sans-serif",
      "scaleRatio": 1.27,
      "weights": { "display": 600, "displayBold": 700, "body": 400, "label": 600, "bold": 600 },
      "displayCase": "none",
      "displayTracking": "-0.02em"
    },
    "space": { "base": 8, "section": "clamp(80px, 10vw, 144px)", "gutter": "clamp(20px, 5vw, 60px)", "density": "balanced" },
    "radius": { "card": "24px", "button": "999px", "input": "16px", "pill": "999px" },
    "shadow": {
      "card": "0 18px 44px -22px rgb(35 48 74 / 0.28)",
      "elevated": "0 36px 72px -30px rgb(35 48 74 / 0.36)",
      "philosophy": "soft"
    },
    "motion": { "ease": "cubic-bezier(0.22, 1, 0.36, 1)", "duration": "560ms", "character": "energetic" },
    "imagery": { "treatment": "rounded", "ratio": "4:3", "filter": "saturate(1.06) contrast(1.02)" }
  },
  "recipes": { "button": "solid-pill", "card": "soft-elevated", "nav": "split-cta" },
  "preferredLayouts": {
    "nav": "split-logo-cta",
    "hero": "playful-learner-floating-ui-blobs",
    "subjects": "color-tile-grid",
    "courses": "course-card-catalog",
    "how": "three-step-path",
    "instructors": "photo-bio-cards",
    "stats": "bright-band-countup",
    "pricing": "three-tier-highlight",
    "testimonials": "quote-photo-cards",
    "cta": "bright-band-enroll",
    "footer": "multi-column-newsletter"
  }
}
